[
  {
    "id": "abia-aba-north",
    "name": "Aba North",
    "state_id": "abia",
    "country_code": "NG",
    "administrative_type": "local_government_area"
  },
  {
    "id": "abia-aba-south",
    "name": "Aba South",
    "state_id": "abia",
    "country_code": "NG",
    "administrative_type": "local_government_area"
  },
  {
    "id": "abia-arochukwu",
    "name": "Arochukwu",
    "state_id": "abia",
    "country_code": "NG",
    "administrative_type": "local_government_area"
  },
  {
    "id": "abia-bende",
    "name": "Bende",
    "state_id": "abia",
    "country_code": "NG",
    "administrative_type": "local_government_area"
  },
  {
    "id": "abia-ikwuano",
    "name": "Ikwuano",
    "state_id": "abia",
    "country_code": "NG",
    "administrative_type": "local_government_area"
  },
  {
    "id": "abia-isiala-ngwa-north",
    "name": "Isiala-Ngwa North",
    "state_id": "abia",
    "country_code": "NG",
    "administrative_type": "local_government_area"
  },
  {
    "id": "abia-isiala-ngwa-south",
    "name": "Isiala-Ngwa South",
    "state_id": "abia",
    "country_code": "NG",
    "administrative_type": "local_government_area"
  },
  {
    "id": "abia-isuikwuato",
    "name": "Isuikwuato",
    "state_id": "abia",
    "country_code": "NG",
    "administrative_type": "local_government_area"
  },
  {
    "id": "abia-obi-nwa",
    "name": "Obi Nwa",
    "state_id": "abia",
    "country_code": "NG",
    "administrative_type": "local_government_area"
  },
  {
    "id": "abia-ohafia",
    "name": "Ohafia",
    "state_id": "abia",
    "country_code": "NG",
    "administrative_type": "local_government_area"
  },
  {
    "id": "abia-osisioma-ngwa",
    "name": "Osisioma Ngwa",
    "state_id": "abia",
    "country_code": "NG",
    "administrative_type": "local_government_area"
  },
  {
    "id": "abia-ugwunagbo",
    "name": "Ugwunagbo",
    "state_id": "abia",
    "country_code": "NG",
    "administrative_type": "local_government_area"
  },
  {
    "id": "abia-ukwa-east",
    "name": "Ukwa East",
    "state_id": "abia",
    "country_code": "NG",
    "administrative_type": "local_government_area"
  },
  {
    "id": "abia-ukwa-west",
    "name": "Ukwa West",
    "state_id": "abia",
    "country_code": "NG",
    "administrative_type": "local_government_area"
  },
  {
    "id": "abia-umuahia-north",
    "name": "Umuahia North",
    "state_id": "abia",
    "country_code": "NG",
    "administrative_type": "local_government_area"
  },
  {
    "id": "abia-umuahia-south",
    "name": "Umuahia South",
    "state_id": "abia",
    "country_code": "NG",
    "administrative_type": "local_government_area"
  },
  {
    "id": "abia-umunneochi",
    "name": "Umunneochi",
    "state_id": "abia",
    "country_code": "NG",
    "administrative_type": "local_government_area"
  },
  {
    "id": "adamawa-demsa",
    "name": "Demsa",
    "state_id": "adamawa",
    "country_code": "NG",
    "administrative_type": "local_government_area"
  },
  {
    "id": "adamawa-fufore",
    "name": "Fufore",
    "state_id": "adamawa",
    "country_code": "NG",
    "administrative_type": "local_government_area"
  },
  {
    "id": "adamawa-ganye",
    "name": "Ganye",
    "state_id": "adamawa",
    "country_code": "NG",
    "administrative_type": "local_government_area"
  },
  {
    "id": "adamawa-girei",
    "name": "Girei",
    "state_id": "adamawa",
    "country_code": "NG",
    "administrative_type": "local_government_area"
  },
  {
    "id": "adamawa-gombi",
    "name": "Gombi",
    "state_id": "adamawa",
    "country_code": "NG",
    "administrative_type": "local_government_area"
  },
  {
    "id": "adamawa-guyuk",
    "name": "Guyuk",
    "state_id": "adamawa",
    "country_code": "NG",
    "administrative_type": "local_government_area"
  },
  {
    "id": "adamawa-hong",
    "name": "Hong",
    "state_id": "adamawa",
    "country_code": "NG",
    "administrative_type": "local_government_area"
  },
  {
    "id": "adamawa-jada",
    "name": "Jada",
    "state_id": "adamawa",
    "country_code": "NG",
    "administrative_type": "local_government_area"
  },
  {
    "id": "adamawa-lamurde",
    "name": "Lamurde",
    "state_id": "adamawa",
    "country_code": "NG",
    "administrative_type": "local_government_area"
  },
  {
    "id": "adamawa-madagali",
    "name": "Madagali",
    "state_id": "adamawa",
    "country_code": "NG",
    "administrative_type": "local_government_area"
  },
  {
    "id": "adamawa-maiha",
    "name": "Maiha",
    "state_id": "adamawa",
    "country_code": "NG",
    "administrative_type": "local_government_area"
  },
  {
    "id": "adamawa-mayo-belwa",
    "name": "Mayo-Belwa",
    "state_id": "adamawa",
    "country_code": "NG",
    "administrative_type": "local_government_area"
  },
  {
    "id": "adamawa-michika",
    "name": "Michika",
    "state_id": "adamawa",
    "country_code": "NG",
    "administrative_type": "local_government_area"
  },
  {
    "id": "adamawa-mubi-north",
    "name": "Mubi North",
    "state_id": "adamawa",
    "country_code": "NG",
    "administrative_type": "local_government_area"
  },
  {
    "id": "adamawa-mubi-south",
    "name": "Mubi South",
    "state_id": "adamawa",
    "country_code": "NG",
    "administrative_type": "local_government_area"
  },
  {
    "id": "adamawa-numan",
    "name": "Numan",
    "state_id": "adamawa",
    "country_code": "NG",
    "administrative_type": "local_government_area"
  },
  {
    "id": "adamawa-shelleng",
    "name": "Shelleng",
    "state_id": "adamawa",
    "country_code": "NG",
    "administrative_type": "local_government_area"
  },
  {
    "id": "adamawa-song",
    "name": "Song",
    "state_id": "adamawa",
    "country_code": "NG",
    "administrative_type": "local_government_area"
  },
  {
    "id": "adamawa-toungo",
    "name": "Toungo",
    "state_id": "adamawa",
    "country_code": "NG",
    "administrative_type": "local_government_area"
  },
  {
    "id": "adamawa-yola-north",
    "name": "Yola North",
    "state_id": "adamawa",
    "country_code": "NG",
    "administrative_type": "local_government_area"
  },
  {
    "id": "adamawa-yola-south",
    "name": "Yola South",
    "state_id": "adamawa",
    "country_code": "NG",
    "administrative_type": "local_government_area"
  },
  {
    "id": "akwa-ibom-abak",
    "name": "Abak",
    "state_id": "akwa-ibom",
    "country_code": "NG",
    "administrative_type": "local_government_area"
  },
  {
    "id": "akwa-ibom-eastern-obolo",
    "name": "Eastern Obolo",
    "state_id": "akwa-ibom",
    "country_code": "NG",
    "administrative_type": "local_government_area"
  },
  {
    "id": "akwa-ibom-eket",
    "name": "Eket",
    "state_id": "akwa-ibom",
    "country_code": "NG",
    "administrative_type": "local_government_area"
  },
  {
    "id": "akwa-ibom-esit-eket",
    "name": "Esit Eket",
    "state_id": "akwa-ibom",
    "country_code": "NG",
    "administrative_type": "local_government_area"
  },
  {
    "id": "akwa-ibom-essien-udim",
    "name": "Essien Udim",
    "state_id": "akwa-ibom",
    "country_code": "NG",
    "administrative_type": "local_government_area"
  },
  {
    "id": "akwa-ibom-etim-ekpo",
    "name": "Etim Ekpo",
    "state_id": "akwa-ibom",
    "country_code": "NG",
    "administrative_type": "local_government_area"
  },
  {
    "id": "akwa-ibom-etinan",
    "name": "Etinan",
    "state_id": "akwa-ibom",
    "country_code": "NG",
    "administrative_type": "local_government_area"
  },
  {
    "id": "akwa-ibom-ibeno",
    "name": "Ibeno",
    "state_id": "akwa-ibom",
    "country_code": "NG",
    "administrative_type": "local_government_area"
  },
  {
    "id": "akwa-ibom-ibesikpo-asutan",
    "name": "Ibesikpo Asutan",
    "state_id": "akwa-ibom",
    "country_code": "NG",
    "administrative_type": "local_government_area"
  },
  {
    "id": "akwa-ibom-ibiono-ibom",
    "name": "Ibiono Ibom",
    "state_id": "akwa-ibom",
    "country_code": "NG",
    "administrative_type": "local_government_area"
  },
  {
    "id": "akwa-ibom-ika",
    "name": "Ika",
    "state_id": "akwa-ibom",
    "country_code": "NG",
    "administrative_type": "local_government_area"
  },
  {
    "id": "akwa-ibom-ikono",
    "name": "Ikono",
    "state_id": "akwa-ibom",
    "country_code": "NG",
    "administrative_type": "local_government_area"
  },
  {
    "id": "akwa-ibom-ikot-abasi",
    "name": "Ikot Abasi",
    "state_id": "akwa-ibom",
    "country_code": "NG",
    "administrative_type": "local_government_area"
  },
  {
    "id": "akwa-ibom-ikot-ekpene",
    "name": "Ikot Ekpene",
    "state_id": "akwa-ibom",
    "country_code": "NG",
    "administrative_type": "local_government_area"
  },
  {
    "id": "akwa-ibom-ini",
    "name": "Ini",
    "state_id": "akwa-ibom",
    "country_code": "NG",
    "administrative_type": "local_government_area"
  },
  {
    "id": "akwa-ibom-itu",
    "name": "Itu",
    "state_id": "akwa-ibom",
    "country_code": "NG",
    "administrative_type": "local_government_area"
  },
  {
    "id": "akwa-ibom-mbo",
    "name": "Mbo",
    "state_id": "akwa-ibom",
    "country_code": "NG",
    "administrative_type": "local_government_area"
  },
  {
    "id": "akwa-ibom-mkpat-enin",
    "name": "Mkpat Enin",
    "state_id": "akwa-ibom",
    "country_code": "NG",
    "administrative_type": "local_government_area"
  },
  {
    "id": "akwa-ibom-nsit-atai",
    "name": "Nsit Atai",
    "state_id": "akwa-ibom",
    "country_code": "NG",
    "administrative_type": "local_government_area"
  },
  {
    "id": "akwa-ibom-nsit-ibom",
    "name": "Nsit Ibom",
    "state_id": "akwa-ibom",
    "country_code": "NG",
    "administrative_type": "local_government_area"
  },
  {
    "id": "akwa-ibom-nsit-ubium",
    "name": "Nsit Ubium",
    "state_id": "akwa-ibom",
    "country_code": "NG",
    "administrative_type": "local_government_area"
  },
  {
    "id": "akwa-ibom-obot-akara",
    "name": "Obot Akara",
    "state_id": "akwa-ibom",
    "country_code": "NG",